[
  {
    "id": "akj-2027-phd-admission-guide",
    "title": "2027년도 전기 일반전형 신입생 모집 안내 (한국학대학원)",
    "publisher": "한국학중앙연구원 한국학대학원",
    "year": 2027,
    "url": "https://grad.aks.ac.kr/cms/usr/wap/selectAplctnDataList.do?siteAplctnId=recruitUks&classifiedSearch=1&postYnSearch=Y&aplctnLangSearch=kor&listAll=1&menuNo=2010111000&lang=kor",
    "checked_on": "2026-10-15",
    "note": "모집요강 PDF(10쪽)는 같은 페이지의 모집요강 다운로드로 받음. 3쪽 모집과정 및 인원(박사 12전공 25명, 총정원제), 7쪽 등록금 및 장학금·기숙사."
  },
  {
    "id": "akj-grad-scholarship-page",
    "title": "한국학대학원 장학금 안내",
    "publisher": "한국학중앙연구원 한국학대학원",
    "year": 2026,
    "url": "https://grad.aks.ac.kr/com/cmm/EgovContentView.do?menuNo=4010150000",
    "checked_on": "2026-10-15",
    "note": "등록금면제·근로·연구·해외학문후속세대 장학과 계속 조건. 근로장학금 금액은 페이지 요약으로 읽음(원문 숫자 재확인 필요)."
  }
]