[
  {
    "id": "sisajournal-2002-doctors-burden",
    "title": "'가문의 부담'이 된 우리 시대 박사님들",
    "publisher": "시사저널",
    "year": 2002,
    "url": "https://www.sisajournal.com/news/articleView.html?idxno=80986",
    "checked_on": "2026-10-14",
    "note": "언론 기사(공개). 인문학 박사 시간강사·미취업 사례."
  },
  {
    "id": "pressian-2019-letter-lecturer-treatment",
    "title": "스승의 날에 교육부장관님께 보내는 편지: 시간강사 처우, 알고 계시는지요",
    "publisher": "프레시안",
    "year": 2019,
    "url": "https://pressian.com/pages/articles/240857",
    "checked_on": "2026-10-14",
    "note": "기고문(공개). 14년차 시간강사 필자, 필자 전공은 글에 없음."
  },
  {
    "id": "khan-2015-local-lecturer-author-talk",
    "title": "[저자와의 대화] '나는 지방대 시간강사다' 저자",
    "publisher": "경향신문",
    "year": 2015,
    "url": "https://www.khan.co.kr/article/201511062041065",
    "checked_on": "2026-10-14",
    "note": "언론 인터뷰(공개). 인문학 박사과정 수료생 저자."
  },
  {
    "id": "brunch-2020-humanities-grad-reality",
    "title": "인문학을 전공하는 대학원생이 된다는 것은(01화)",
    "publisher": "브런치",
    "year": 2020,
    "url": "https://brunch.co.kr/@wannabephd/4",
    "checked_on": "2026-10-14",
    "note": "공개 수필(브런치 연재). 인문학 박사과정 필자."
  },
  {
    "id": "dhnews-2025-soonchunhyang-humsoc-stipend",
    "title": "순천향대 대학원, '인문사회 연구장려금' 석·박사 동시 선정",
    "publisher": "대학저널",
    "year": 2025,
    "url": "https://www.dhnews.co.kr/news/view/1065589891996192",
    "checked_on": "2026-10-14",
    "note": "언론 기사(공개). 교육부·한국연구재단 사업 보도."
  },
  {
    "id": "newsis-2019-humsoc-230billion",
    "title": "'문과라서 죄송해' 막자…2300억 투입 인문·사회학 살린다",
    "publisher": "뉴시스",
    "year": 2019,
    "url": "https://mobile.newsis.com/view/NISX20190404_0000609548",
    "checked_on": "2026-10-14",
    "note": "언론 기사(공개). 정부 지원 사업 보도."
  },
  {
    "id": "brunch-2022-curator-job-musings",
    "title": "학예사라는 직업에 대한 단상",
    "publisher": "브런치",
    "year": 2022,
    "url": "https://brunch.co.kr/@podolc/19",
    "checked_on": "2026-10-14",
    "note": "공개 수필. 전공 미기재, 석사 출신 기간제 연구원 필자."
  },
  {
    "id": "brunch-2024-before-humanities-grad-school",
    "title": "문과 대학원에 진학하려는 당신에게",
    "publisher": "브런치",
    "year": 2024,
    "url": "https://brunch.co.kr/@d6fb9d2b2da74f6/1",
    "checked_on": "2026-10-14",
    "note": "공개 수필. 문과 대학원 5년 수학 후 중도 하차한 회사원 필자."
  },
  {
    "id": "brunch-2025-grad-student-mental-health",
    "title": "대학원생의 정신건강(대학원생, 오늘 12화)",
    "publisher": "브런치",
    "year": 2025,
    "url": "https://brunch.co.kr/@yuhyeon/64",
    "checked_on": "2026-10-14",
    "note": "공개 수필. 사회과학 대학원생 필자."
  },
  {
    "id": "brunch-2025-sociology-pride",
    "title": "사회학 전공 부심",
    "publisher": "브런치",
    "year": 2025,
    "url": "https://brunch.co.kr/@woongscool/246",
    "checked_on": "2026-10-14",
    "note": "공개 수필. 사회학 석사 출신 회사원 필자."
  },
  {
    "id": "brunch-2026-received-phd",
    "title": "박사학위를 수여받았다",
    "publisher": "브런치",
    "year": 2026,
    "url": "https://brunch.co.kr/@4512181fbc904d2/9",
    "checked_on": "2026-10-14",
    "note": "공개 수필. 북한학 박사 필자."
  },
  {
    "id": "slownews-2015-lecturer-thesis",
    "title": "나는 시간강사다: 학위 논문을 쓰다",
    "publisher": "슬로우뉴스",
    "year": 2015,
    "url": "https://slownews.kr/39227",
    "checked_on": "2026-10-14",
    "note": "공개 연재 칼럼. 같은 필자의 석사논문 회고."
  },
  {
    "id": "ziksir-2014-lecturer-life-start",
    "title": "<나는 지방대 시간강사다> 1. 이 삶의 시작",
    "publisher": "직썰",
    "year": 2014,
    "url": "https://www.ziksir.com/news/articleView.html?idxno=1122",
    "checked_on": "2026-10-14",
    "note": "공개 연재 칼럼. 지방대 인문학 시간강사 필자."
  },
  {
    "id": "gspress-2016-lecturer-survival",
    "title": "통장이 가난한 자에게는 빚도 없나니 - 강사로 살아남기",
    "publisher": "대학원신문",
    "year": 2016,
    "url": "http://gspress.cauon.net/news/articleView.html?idxno=21276",
    "checked_on": "2026-10-14",
    "note": "대학 신문 좌담(공개). 심리학·사회복지·서양미술 전공 시간강사 3명."
  },
  {
    "id": "kunews-2023-grad-student-worker-status",
    "title": "학업·근로 병행하는 대학원생, 노동자성 인정할 수 있을까",
    "publisher": "고대신문",
    "year": 2023,
    "url": "http://www.kunews.ac.kr/news/articleView.html?idxno=41558",
    "checked_on": "2026-10-14",
    "note": "대학 신문 기획 기사(공개). 판결 보도와 실태조사 인용."
  },
  {
    "id": "hangyo-2015-whose-pain",
    "title": "이런 사람들의 아픔, 누가 알아줄까",
    "publisher": "한국교육신문",
    "year": 2015,
    "url": "https://hangyo.com/mobile/article.html?no=71094",
    "checked_on": "2026-10-14",
    "note": "칼럼(공개). 시간강사 연재글 인용."
  },
  {
    "id": "kyosu-2025-croatian-student-humanities-prof",
    "title": "인문계열 교수가 되는 길, 여전히 열려 있을까",
    "publisher": "교수신문",
    "year": 2025,
    "url": "http://www.kyosu.net/news/articleView.html?idxno=148484",
    "checked_on": "2026-10-14",
    "note": "기고(공개). 외국인 유학생 출신 동아시아학 박사 필자의 구직."
  },
  {
    "id": "kyosu-2015-humanities-phd-salary",
    "title": "'인문학 박사' 5명 중 2명은 연봉 2천만원 미만",
    "publisher": "교수신문",
    "year": 2015,
    "url": "https://www.kyosu.net/news/articleView.html?idxno=30726",
    "checked_on": "2026-10-14",
    "note": "언론 기사(공개). 한국직업능력개발원 박사조사 분석. 숫자 후보용."
  },
  {
    "id": "kyosu-2026-young-researcher-mental-health",
    "title": "신진 연구자 30% 우울·불안·자살생각…\"생활고에 무력감\"",
    "publisher": "교수신문",
    "year": 2026,
    "url": "https://www.kyosu.net/news/articleView.html?idxno=210571",
    "checked_on": "2026-10-14",
    "note": "언론 기사(공개). 숫자 후보용. 개별 사건은 레코드로 쓰지 않음."
  },
  {
    "id": "brunch-2019-student-loan-repay-plan",
    "title": "\"학자금 대출 취업 후 상환\" 계획 세우기",
    "publisher": "브런치",
    "year": 2019,
    "url": "https://brunch.co.kr/@emforce/111",
    "checked_on": "2026-10-14",
    "note": "공개 정보 글(브랜드 계정 에디터 체험). 학부 대출로 보임. 숫자 후보용."
  },
  {
    "id": "brunch-2021-phd-after-graduation",
    "title": "박사들은 졸업하고 뭘할까?",
    "publisher": "브런치",
    "year": 2021,
    "url": "https://brunch.co.kr/@linamond/5",
    "checked_on": "2026-10-14",
    "note": "공개 수필. 필자 전공 미기재(대기업 데이터 사이언티스트 취업만 언급)이며 한국직업능력개발원 통계 인용. 숫자 후보용."
  }
]
