[
  {
    "id": "law-educational-public-officials-act-art47",
    "title": "교육공무원법 제47조(정년)",
    "publisher": "국가법령정보센터(법제처)",
    "year": 2026,
    "url": "https://www.law.go.kr/법령/교육공무원법/제47조",
    "checked_on": "2026-10-13",
    "note": "교육공무원(국립대 교원 포함)의 정년 65세. 결정 기록 0014 #99의 교수 정년 출처. Wave 4 #47에서 출처만 등록했고 조문 재확인과 값 레코드화는 #48 범위. 사립대 교원은 사립학교법 제53조의2가 교육공무원 규정을 준용한다."
  },
  {
    "id": "law-state-public-officials-act-art74",
    "title": "국가공무원법 제74조(정년)",
    "publisher": "국가법령정보센터(법제처)",
    "year": 2026,
    "url": "https://www.law.go.kr/법령/국가공무원법/제74조",
    "checked_on": "2026-10-13",
    "note": "일반직 공무원(연구직 공무원 포함)의 정년 60세. 결정 기록 0014 #99의 연구직 공무원 정년 출처. Wave 4 #47에서 출처만 등록, 조문 재확인은 #48 범위."
  },
  {
    "id": "nst-2026-institute-retirement-rule",
    "title": "국가과학기술연구회 소관 출연연 인사규정의 정년(61세)",
    "publisher": "국가과학기술연구회(NST) 및 소관 출연연",
    "year": 2026,
    "url": "https://www.nst.re.kr/",
    "checked_on": "2026-10-13",
    "note": "출연연 연구직 정년 61세(우수연구원 정년 연장 65세는 별도 제도)는 법률이 아니라 각 기관 인사규정에 있다. 결정 기록 0014 #99의 출연연 정년 출처 자리. 기관별 규정 조문 URL 확인과 값 레코드화는 #48 범위."
  }
]
