[
  {
    "id": "nhrc-2015-grad-research-env-survey",
    "title": "대학원생 연구환경에 대한 실태조사 결과 발표 및 토론회 (2015-11-13 자료집; 설문 2015-06-08~22, n=1,906)",
    "publisher": "국가인권위원회 (조사 수행: 한국교육연구소)",
    "year": 2015,
    "url": "https://library.humanrights.go.kr/dl_image/IMG/01//000000000955/SERVICE/000000000955_01.PDF",
    "checked_on": "2026-10-15",
    "note": "출처 계급: 정부기관 발표 자료집. PDF 200쪽 중 18쪽(인쇄 쪽 12)의 그림 3.3·3.4 확인. 대학원생 전체 대상, 중복응답, 박사 분리 수치 없음. 표본 추출 방식 미확인."
  },
  {
    "id": "kostat-2025-single-household",
    "title": "2025 통계로 보는 1인가구 (보도자료 첨부 hwpx)",
    "publisher": "국가데이터처(구 통계청), 정책브리핑 게시",
    "year": 2025,
    "url": "https://www.korea.kr/briefing/pressReleaseView.do?newsId=156734077",
    "checked_on": "2026-10-15",
    "note": "2025-12-09 배포. 첨부 hwpx(fileId=198292934)를 내려받아 본문과 통계표 '15. 소비지출'(자료: 가계동향조사) 확인. 2024년 1인가구 월평균 소비지출 1,689천원, 시계열 2019~2024. 연령·지역 분해는 이 문서에 없음. 쪽 번호는 목차 기준."
  }
]