[
  {
    "id": "moel-2025-minwage-2026-press",
    "title": "2026년 적용 최저임금 시간급 10,320원 (보도자료)",
    "publisher": "고용노동부",
    "year": 2025,
    "url": "https://www.moel.go.kr/news/enews/report/enewsView.do?news_seq=18144",
    "checked_on": "2026-10-14",
    "note": "정부 보도자료(2025-08-05). 본문에 2026년도 적용 최저임금 시간급 10,320원(전년 대비 290원, 2.9% 인상), 월 환산액 2,156,880원(주 40시간, 월 209시간 기준) 명시. 고시 번호는 같은 부처 고시 게시글(bbs_seq=20250800121)의 첨부 파일명 「2026년 적용 최저임금 고시(고용노동부 고시 제2025-47호)」에서 확인. 고시 PDF 본문은 열지 않음."
  },
  {
    "id": "moel-2026-minwage-2027-press",
    "title": "2027년도 적용 최저임금 시간급 10,700원 (보도자료)",
    "publisher": "고용노동부",
    "year": 2026,
    "url": "https://www.moel.go.kr/news/enews/report/enewsView.do?news_seq=19744",
    "checked_on": "2026-10-14",
    "note": "정부 보도자료(등록일 2026-08-05). 본문에 2027년도 적용 최저임금 시간급 10,700원(올해 10,320원보다 380원, 3.7% 인상) 결정·고시 명시. 고시 번호는 같은 부처 고시 게시글(bbs_seq=20260800150, 등록일 2026-08-05, 근거 최저임금법 제10조제1항)의 첨부 파일명 「2027년 적용 최저임금 고시(고용노동부 고시 제2026-60호)」에서 확인. 고시 PDF 본문은 열지 않음."
  },
  {
    "id": "kostat-2025-cpi-annual",
    "title": "2025년 12월 및 연간 소비자물가동향",
    "publisher": "국가데이터처(구 통계청)",
    "year": 2025,
    "url": "https://kostat.go.kr/board.es?mid=a10301010000&bid=213&tag=&act=view&list_no=442792",
    "checked_on": "2026-10-14",
    "note": "보도자료(게시일 2025-12-31). 본문에 \"2025년 연간 소비자물가지수는 전년에 비해 2.1% 상승\" 명시. 첨부 PDF·통계표는 열지 않아 지수 수준값은 확인하지 못함. 통계청은 국가데이터처로 개편됨."
  },
  {
    "id": "bok-inflation-target",
    "title": "물가안정목표제 (한국은행 통화정책 목표)",
    "publisher": "한국은행",
    "year": 2026,
    "url": "https://www.bok.or.kr/portal/main/contents.do?menuNo=200291",
    "checked_on": "2026-10-14",
    "note": "한국은행 누리집. \"2019년 이후 물가안정목표는 소비자물가 상승률(전년동기대비) 기준 2%이다\"(한국은행법 제6조제1항에 따라 정부와 협의해 설정). 2026-10-14 열람."
  }
]
